{
  "directive_version": "1.0",
  "directive_id": "live-valid-status-request-001",
  "project": "AI-CONTROL-PLANE",
  "target_project": "AI-CONTROL-PLANE",
  "target_stage": "CONTROL-02.5",
  "action_type": "STATUS_REQUEST",
  "action": "RUN_READ_ONLY_OBSERVATION",
  "created_at": "2026-08-18T20:00:00Z",
  "expires_at": "2026-08-25T20:00:00Z",
  "issued_by": "CHATGPT",
  "source_repository": "AI-CONTROL-PLANE",
  "source_branch": "main",
  "source_commit_sha": "PENDING_COMMIT_SHA",
  "requires_human_approval": false,
  "allowed_scope": [
    "READ",
    "AUDIT",
    "REPORT"
  ],
  "preconditions": {},
  "success_criteria": {},
  "failure_policy": "REJECT_AND_LOG",
  "rollback_policy": "NO_MUTATION",
  "payload": {}
}
